{
  "orderNumber": "1",
  "orderDate": "2020-06-27",
  "isGift": false,
  "orderedItem": [
    {
      "orderItemNumber": "1001",
      "identifier": "book",
      "name": "サンプル書籍",
      "orderQuantity": 1,
      "price": 3800
    },
    {
      "orderItemNumber": "61059",
      "identifier": "furniture",
      "name": "テスト椅子",
      "orderQuantity": 2,
      "price": 12000
    }
  ]
}
